{
  "$id": "https://example.com/traust-contracts/schemas/v1/vuln-findings.schema.json",
  "$schema": "https://json-schema.org/draft/2020-12/schema",
  "title": "Vuln-Scan Findings Schema",
  "description": "Output contract of the vuln-scan skill (<repo>-vuln-findings.json, harness >= 0.38.0). Shares vocabulary with report.schema.json: the severity_level enum is identical and finding ids use the canonical {REPO_SLUG}-{SHORTSHA}-{NNN} campaign pattern. Findings are UNVERIFIED candidates ('claimed' in findings-lifecycle terms) awaiting /triage; known_findings are candidates deduped against the target's *-security-audit.json baseline. Legacy VULN-FINDINGS.json files (pre-0.38.0) do not conform and are not auto-detected against this schema.",
  "type": "object",
  "required": [
    "target",
    "scanned_at",
    "focus_areas",
    "metadata",
    "findings",
    "summary"
  ],
  "properties": {
    "target": {
      "type": "string",
      "minLength": 1
    },
    "scanned_at": {
      "description": "ISO-8601 timestamp of the scan.",
      "type": "string",
      "minLength": 10
    },
    "focus_areas": {
      "type": "array",
      "minItems": 1,
      "items": {
        "type": "string",
        "minLength": 1
      }
    },
    "metadata": {
      "$ref": "#/$defs/metadata"
    },
    "findings": {
      "type": "array",
      "minItems": 0,
      "$comment": "Empty is valid: a clean sweep (or one where every candidate matched the baseline) yields zero new findings.",
      "items": {
        "$ref": "#/$defs/finding"
      }
    },
    "known_findings": {
      "type": "array",
      "items": {
        "$ref": "#/$defs/known_finding"
      }
    },
    "review_surface_coverage": {
      "$ref": "report.schema.json#/$defs/scan_review_surface_coverage",
      "description": "Review-surface coverage of the scanned code (the whole tree, or the diff for a --diff scan): one entry per surface. A surface the diff does not touch is out_of_scope. The cumulative builder merges this record into the repo's cumulative report (*-findings-current.json)."
    },
    "summary": {
      "$ref": "#/$defs/summary"
    }
  },
  "additionalProperties": false,
  "$defs": {
    "severity_level": {
      "type": "string",
      "enum": [
        "critical",
        "high",
        "medium",
        "low",
        "informational"
      ]
    },
    "metadata": {
      "type": "object",
      "required": [
        "repo",
        "repo_slug",
        "scanned_ref",
        "harness_version",
        "baseline",
        "baseline_findings"
      ],
      "properties": {
        "repo": {
          "type": "string",
          "minLength": 1
        },
        "repo_slug": {
          "description": "Repo name uppercased, [^A-Z0-9] -> '_', truncated to 24 chars \u2014 the id prefix.",
          "type": "string",
          "pattern": "^[A-Z][A-Z0-9_]{0,23}$"
        },
        "scanned_ref": {
          "description": "Short SHA of the scanned commit (7 lowercase hex), or '0000000 (not a git checkout)'.",
          "type": "string",
          "pattern": "^[a-f0-9]{7}( \\(not a git checkout\\))?$"
        },
        "harness_version": {
          "description": "Harness semver + short SHA at scan time, e.g. 0.38.0-de5a090.",
          "type": "string",
          "pattern": "^\\d+\\.\\d+\\.\\d+(-[a-f0-9]{7,12})?$"
        },
        "baseline": {
          "description": "Path of the matched <repo>-security-audit.json, or null when the target has no audit baseline.",
          "type": [
            "string",
            "null"
          ]
        },
        "baseline_findings": {
          "type": "integer",
          "minimum": 0
        },
        "additional": {
          "description": "Free-form extension bag (same convention as report.schema.json): deterministic_steps recording, and in --diff mode the coverage_diff stamp (changed_files_covered, callers_covered, refused_or_skipped, baseline_report, anchor, resolution_source) and the spend calibration stamp.",
          "type": "object"
        }
      },
      "additionalProperties": false
    },
    "finding": {
      "type": "object",
      "required": [
        "id",
        "file",
        "line",
        "category",
        "severity",
        "confidence",
        "title",
        "description",
        "recommendation"
      ],
      "properties": {
        "id": {
          "$comment": "Canonical campaign id only \u2014 this artifact type postdates the legacy id scheme.",
          "type": "string",
          "pattern": "^[A-Z][A-Z0-9_]{0,23}-[a-f0-9]{7}-\\d{3}$"
        },
        "scanner_ref": {
          "description": "The review subagent's working id (F-<focus>-<n>), kept for traceability.",
          "type": "string"
        },
        "file": {
          "type": "string",
          "minLength": 1
        },
        "line": {
          "$comment": "Null when the scanner could only cite the enclosing function (the description must say so).",
          "type": [
            "integer",
            "null"
          ],
          "minimum": 1
        },
        "category": {
          "type": "string",
          "minLength": 1
        },
        "cwe": {
          "description": "Primary CWE for the category; feeds the baseline fold-in's required cwes[].",
          "type": "string",
          "pattern": "^CWE-\\d{1,5}$"
        },
        "severity": {
          "$ref": "#/$defs/severity_level"
        },
        "confidence": {
          "type": "number",
          "minimum": 0.0,
          "maximum": 1.0
        },
        "title": {
          "type": "string",
          "minLength": 5
        },
        "description": {
          "type": "string",
          "minLength": 50
        },
        "exploit_scenario": {
          "type": "string"
        },
        "recommendation": {
          "type": "string",
          "minLength": 10
        },
        "confidence_reason": {
          "type": "string"
        },
        "fingerprint": {
          "type": "string",
          "pattern": "^[0-9a-f]{64}$",
          "description": "Deterministic cross-scan identity (identity module fingerprint). Optional here -- no artifact of this kind carries one today -- but DECLARED, because additionalProperties is false and an undeclared identity field makes every stamped artifact invalid the moment a producer starts emitting it. That has happened twice: report.schema.json omitted fingerprint_algo for 16 days, and the cloud-config schema declared neither, so stamping the policy findings invalidated nearly every report in one command."
        },
        "fingerprint_algo": {
          "type": "string",
          "pattern": "^v\\d+$",
          "description": "Algorithm version of `fingerprint` (the identity module ALGO_VERSION). Declared for the same reason as `fingerprint` above."
        }
      },
      "additionalProperties": false
    },
    "known_finding": {
      "type": "object",
      "required": [
        "title",
        "matches_baseline_id"
      ],
      "properties": {
        "title": {
          "type": "string",
          "minLength": 1
        },
        "matches_baseline_id": {
          "description": "The baseline audit finding this candidate duplicates.",
          "type": "string",
          "minLength": 1
        }
      },
      "additionalProperties": false
    },
    "summary": {
      "type": "object",
      "required": [
        "total",
        "critical",
        "high",
        "medium",
        "low",
        "informational",
        "known",
        "low_confidence"
      ],
      "properties": {
        "total": {
          "type": "integer",
          "minimum": 0
        },
        "critical": {
          "type": "integer",
          "minimum": 0
        },
        "high": {
          "type": "integer",
          "minimum": 0
        },
        "medium": {
          "type": "integer",
          "minimum": 0
        },
        "low": {
          "type": "integer",
          "minimum": 0
        },
        "informational": {
          "type": "integer",
          "minimum": 0
        },
        "known": {
          "type": "integer",
          "minimum": 0
        },
        "low_confidence": {
          "type": "integer",
          "minimum": 0
        }
      },
      "additionalProperties": false
    }
  }
}
