{
  "target": "/tmp/drain1/gcp-project-operator/clone",
  "scanned_at": "2026-07-27T23:59:00Z",
  "focus_areas": [
    "controllers (projectclaim/projectreference namespace-validation change and its deletion-path ordering)",
    "api types (new Validate methods + tests)",
    "(root) dependency manifests (go.mod/go.sum) and prek/gitleaks configs",
    ".claude agent hooks and prow-ci skill scripts",
    "boilerplate + deploy manifests (RBAC narrowing, Dockerfiles, tekton pipeline)"
  ],
  "metadata": {
    "repo": "gcp-project-operator",
    "repo_slug": "GCP_PROJECT_OPERATOR",
    "scanned_ref": "6359353",
    "harness_version": "0.193.0-e759baf",
    "baseline": "/Users/mchubirk/Hybrid-Platforms-Sec/analysis-results/findings/osd-operators/gcp-project-operator/gcp-project-operator-findings-current.json",
    "baseline_findings": 9,
    "additional": {
      "deterministic_steps": {
        "resolve_baseline": "ran (anchor 76f274a, resolution_source auto, no refusal)",
        "build_diff_packet": "ran (45 changed files, 5 clusters, C=2538, 40 caller sites, 1 caller-cap omission)",
        "opengrep": "ran (5 facts, all hps-bash-data-exposure-xtrace in vendored boilerplate/* scripts; the one changed file hit, boilerplate/update:14, is on an unchanged line, env-var gated, vendored upstream - dismissed)",
        "k8s-hardening": "skipped (no K8s workload YAML among changed files: only RBAC ClusterRoles and a Tekton PipelineRun changed)",
        "osv-scanner": "ran (8 advisory-package pairs: 4 Go from changed go.mod - grpc pair carried as low-confidence candidate finding; 4 PyPI from unchanged boilerplate test-requirements.txt - out of diff scope)"
      },
      "coverage_diff": {
        "changed_files_covered": 45,
        "changed_files_total": 45,
        "caller_sites_covered": 40,
        "refused_or_skipped": [
          {
            "item": "caller expansion beyond cap",
            "reason": "caller cap (40) reached at .claude/skills/prow-ci/fetch_prow_artifacts.py:main; remaining references unlisted in packet"
          },
          {
            "item": "go.sum full hunk",
            "reason": "packet truncated go.sum diff at 20000 bytes (lockfile hashes); dependency posture assessed via full go.mod hunk + osv-scanner instead"
          }
        ],
        "baseline_report": "/Users/mchubirk/Hybrid-Platforms-Sec/analysis-results/findings/osd-operators/gcp-project-operator/gcp-project-operator-findings-current.json",
        "anchor": "76f274a732890eed715b6103f87e9338c53825ac",
        "resolution_source": "auto",
        "notes": "Supersedes the same-ref (6359353) diff-scan written at harness 0.186.1: its four findings were independently re-verified against the clone and carried forward (re-ranked); one new high-severity finding added. Diff also contains partial remediation of baseline FIND-002 (ClusterRole narrowed: pods/configmaps/services/apps CRUD removed; cluster-wide secrets CRUD remains) and the fix attempt for FIND-001."
      },
      "spend": {
        "usd": null,
        "tokens_in": null,
        "tokens_out": null
      },
      "model_routing": {
        "skill": "vuln-scan",
        "model": "claude-mythos-5",
        "source": "orchestrator-pinned (drain-tranche-1)"
      }
    }
  },
  "findings": [
    {
      "id": "GCP_PROJECT_OPERATOR-6359353-001",
      "scanner_ref": "F-01-01",
      "file": "controllers/projectclaim/projectclaim_fake.go",
      "line": 93,
      "category": "auth-bypass",
      "cwe": "CWE-863",
      "severity": "high",
      "confidence": 0.85,
      "title": "Deletion paths run before the new namespace validation: fake-ProjectClaim finalizer path deletes arbitrary cross-namespace Secrets",
      "description": "The FIND-001 remediation inserts ProjectClaim.Validate() into both reconcile paths, but in both cases the deletion branch executes BEFORE validation, and the deletion branch is exactly where the operator performs writes against the attacker-referenced secret. (1) Fake path: EnsureProjectClaimFakeProcessed (controllers/projectclaim/projectclaim_fake.go:84-121) calls EnsureFinalizer() at line 88 - before Validate() at line 101 - so even a claim that fails the new cross-namespace check still receives ProjectClaimFinalizer, guaranteeing a deletion reconcile. The DeletionTimestamp branch (lines 92-100) then calls DeleteFakeSecret() (lines 31-46), which does client.Get + client.Delete on Spec.GCPCredentialSecret.{Namespace,Name} verbatim - no namespace check - using the operator's cluster-wide secrets delete (deploy/cluster_role.yaml still grants delete on secrets in all namespaces). (2) Non-fake path: ReconcileHandler's operation list (controllers/projectclaim/projectclaim_controller.go:102-115) orders EnsureProjectClaimDeletionProcessed before the new EnsureProjectClaimValidated, and FinalizeProjectClaim -> EnsureCCSSecretFinalizerDeleted -> getCCSSecret (projectclaimadapter.go:264-276) reads the unvalidated Spec.CCSSecretRef and deleteFinalizer issues client.Update on that foreign secret, stripping the operator's deletion-protection finalizer from another tenant's CCS credential secret. This is the same ordering gap as the DeletionTimestamp skip in projectreference_controller.go:84 (see -002). The new Validate() therefore closes the create-time read path of baseline FIND-001 but leaves the delete-time write paths open.",
      "exploit_scenario": "A principal with create/delete rights on projectclaims.gcp.managed.openshift.io in its own namespace (the operator's intended tenant interface) creates a ProjectClaim annotated FakeProjectClaim=true with spec.gcpCredentialSecret={namespace: <victim-ns>, name: <victim-secret>}. The first reconcile adds the finalizer (line 88, pre-validation) and then parks the claim in Error state via the new Validate(). The attacker deletes the claim; the deletion reconcile enters the fake branch before Validate and the operator deletes <victim-ns>/<victim-secret> with its cluster-wide RBAC - arbitrary cross-namespace Secret deletion (e.g. another tenant's GCP credential secret, breaking their cluster and destroying key material availability). Variant: a valid CCS claim is updated to point ccsSecretRef at another tenant's secret (update wedges the claim in Error but the finalizer is already present), then deleted - the operator strips CCSSecretFinalizer from the victim secret, removing its deletion protection while its GCP project still depends on it.",
      "recommendation": "Enforce the namespace check at the sinks, not only in reconcile order: have DeleteFakeSecret() and getCCSSecret() refuse any secret reference whose namespace differs from the ProjectClaim's namespace (deletion-time cleanup of a previously-valid same-namespace ref is unaffected, so finalizers cannot wedge). Additionally move EnsureFinalizer after validation in the fake path, and prefer CRD-level CEL immutability/validation on gcpCredentialSecret.namespace and ccsSecretRef.namespace so invalid refs can never be persisted.",
      "confidence_reason": "Verified directly in the clone at 6359353: operation ordering in ReconcileHandler and EnsureProjectClaimFakeProcessed, finalizer-before-validation at projectclaim_fake.go:88, raw use of the spec reference in DeleteFakeSecret (client.Delete) and getCCSSecret (client.Get + client.Update via deleteFinalizer), and the ClusterRole retaining cluster-wide secrets delete/update. Not exercised against a live cluster."
    },
    {
      "id": "GCP_PROJECT_OPERATOR-6359353-002",
      "scanner_ref": "F-02-01",
      "file": "controllers/projectreference/projectreference_controller.go",
      "line": 85,
      "category": "auth-bypass",
      "cwe": "CWE-863",
      "severity": "medium",
      "confidence": 0.6,
      "title": "ProjectReference.Validate is self-referential: forged ProjectReference in a tenant namespace still reaches cross-namespace CCS secret read",
      "description": "The FIND-001 remediation adds ProjectReference.Validate() (api/v1alpha1/projectreference_types.go:99-106), which only checks Spec.CCSSecretRef.Namespace == Spec.ProjectClaimCRLink.Namespace — both fields live in the same attacker-supplied spec, so the check is satisfiable by construction. The manager watches cluster-wide (main.go:79-89 sets no cache namespace restriction) and Reconcile never pins req.Namespace to the operator namespace (operatorNamespace const at line 44 is used only for the non-CCS org-secret default). A principal able to create ProjectReference CRs in any namespace can set ProjectClaimCRLink.Namespace = CCSSecretRef.Namespace = <victim-ns>, pass Validate at line 85, and reach getGcpClient (line 97 -> 156-165), which calls util.GetGCPCredentialsFromSecret with the attacker-chosen namespace/name before any cross-check against a real ProjectClaim. Additionally, the deletion path (line 84: DeletionTimestamp != nil) skips Validate entirely but still executes getGcpClient, so even the self-referential check is bypassed on delete. Enforcement-sibling gap per the depth heuristic: the ProjectClaim path got a reconcile-order guard (EnsureProjectClaimValidated) but the equivalent guard on the ProjectReference path validates attacker-controlled data against attacker-controlled data. Nearest baseline finding: FIND-001 (this is the residual vector its fix does not close).",